Title,Global Sentiment
Beijing Needs a Spending Binge to Boost Growth,1
 PBOC Needs to Act on Mid-Year Cash Demand Peak,1
 Bernanke Says Fed `Prepared' if Stimulus Needed,0
" Stocks Halt 3-Day Slump on Bernanke, China",1
" Emerging Stocks, U.S. Futures Advance on China; Gold Record",1
" China Stocks, Economy, Central Bank Policy Under Scrutiny",1
" Bernanke's Testimony to Congress, Statement Awaited.",1
"Stocks, Treasuries, Oil Decline as Bernanke Damps Stimulus Bets",-1
S&P 500 Index Drops to Lowest Level of the Month,-1
Gold and Silver Rally Amid Economic Uncertainty,0
Ten-Year Treasury Yields Climb Amid Concerns Over U.S. Credit Rating,1
"Crude Slides 2.4 Percent, Gold Touches Record High",-1
Bernanke's Remarks Dampen Speculation of Third Round of Quantitative Easing,-1
Treasuries Slide After Moody's Warning of Potential U.S. Credit Rating Cut,1
"Industrial, Technology, and Raw-Material Companies Suffer Most in S&P 500",-1
JPMorgan Chase & Co. Rallies After Better-Than-Expected Earnings,1
 Google Inc. Reports Sales and Profit That Top Analysts' Estimates,-1
 U.S. Wholesale Costs Drop More Than Forecast in June,-1
 New Zealand Dollar Strengthens Against Major Peers,0
 Treasury Attracts Higher-Than-Average Demand at 30-Year Bond Auction,-1
 Moody's Puts U.S. Aaa Credit Rating on Review for Potential Downgrade,-1
 Credit-Default Swaps Insuring U.S. Debt Climb to Highest Since February 2010,-1
" Italian Government Bonds Decline, Sending 10-Year Yield Up",-1
" Spanish 10-Year Bond Yield Rises, Increasing Premium Over German Bunds",-1
 Software AG Plunges After Reporting Sales Decline,-1
Gold Rises for a Ninth Day as Dollar Index Falls,1
Oil Advances Amid Gains in Energy and Technology Shares,1
Eight Banks Fail European Union Stress Tests,0
U.S. House Republicans Plan Vote on Measure to Cut Spending,1
S&P's Ratings Services Announces Potential Lowering of U.S. Credit Rating,1
Moody's Places U.S. Credit Rating Under Review for Downgrade,1
U.S. Faces $60 Trillion Net Present Value Liability Burden,1
Consumer Sentiment Falls in July,1
Yields on 10-Year Treasury Notes Fall for Second Consecutive Week,-1
 Euro Records Second Weekly Decline,0
 Eight European Banks Fail EU Stress Tests,0
 Corporate Earnings in U.S. Top Analyst Estimates,1
 Energy Stocks Rise in S&P Index,1
 BHP Billiton Agrees to Buy Petrohawk Energy Corp.,-1
 Carl Icahn Offers to Buy Clorox Co.,1
Global Stocks and Oil Prices Drop Amid Debt Concerns,-1
Gold Extends Longest Rally Since 1980,1
Euro Recovers Losses After Reaching All-Time Low Versus Swiss Franc,0
European Bank Shares Slump to Two-Year Low Amid Debt Crisis,-1
Goldman Sachs Cuts Forecasts for U.S. Economic Growth,-1
S&P 500 Falls Below Lowest Closing Level Since June 28,-1
Halliburton Reports 54% Profit Jump,0
Bridgewater Associates Predicts Difficult Period for Financial Markets,-1
" Global Demand for U.S. Stocks, Bonds and Other Financial Assets Rises in May",-1
 Goldman Sachs Cuts U.S. Economic Growth Forecast,-1
 U.S. Lawmakers Struggle to Reach Agreement on Debt Limit,-1
 European Bank Stocks Drop Amid Debt Crisis,-1
 Gold for August Delivery Climbs for a 10th Day,1
 Oil for August Delivery Slips 1.4% to $95.93 a Barrel,-1
" Euro Weakens Against Yen, Dollar Strengthens Against Major Counterparts",-1
" Credit-Default Swaps on Greece, Ireland, Italy, Portugal and France Rise to Records",-1
 Risk of Euro-Area Contagion Rises for Eastern Europe,-1
 Hungarian Forint Reaches Record Low Against Franc,1
 Franc-Denominated Home Loans Represent 53% of All Mortgages in Poland.,-1
Stocks and Treasuries Rally on Earnings and Deficit Plan,1
Oil Surges Amid Market Optimism,1
S&P 500 Records Biggest Gain in Four Months,1
"Apple Inc. Beats Earnings Estimates, Stock Rises",1
IBM and Coca-Cola Report Higher-Than-Estimated Results,1
Goldman Sachs Reports Second-Quarter Profit Below Analysts' Estimates,0
U.S. Housing Starts Increase More Than Forecast in June,1
Cotton and Corn Prices Rise Due to Weather Concerns,1
 European Union Leaders Plan Second Meeting to Discuss Greek Rescue,1
 China Merchants Bank Plans to Raise Funds Through Rights Offer,0
 HDFC Bank Ltd. Earnings Top Analysts' Estimates,1
 U.S. Stock Market Wrap: Stocks Surge Amid Earnings Optimism,1
 U.S. Housing Starts Reach 5-Month High in June,1
" Asia Stocks React to U.S., Greece Debt Developments.",1
U.S. Stocks and Treasuries Retreat Amid Debt Concerns,1
Oil Rallies as Senate Plan Faces Resistance from House Republicans,1
Italian and Spanish Bonds Rally Ahead of European Debt-Crisis Summit,1
President Obama Renews Talks to Cut Federal Deficit and Increase Debt Ceiling,0
Apple Inc. Reports Higher-Than-Estimated Results,1
House Republicans Pass Debt-Reduction Plan,0
Senate Plan Combines Spending Cuts with Tax Increases,0
Apple's Profit Doubles Amid Record Sales of iPhones and iPads,1
" S&P 500 Technology Stocks Decline, Financial Stocks Gain",0
 United Technologies Corp. Declines After Boeing Co. Chooses Competing Jet-Engine Maker,1
 Clorox Co. Rallies After Carl Icahn Increases Offer to Buy the Company,1
 Oil Rises as U.S. Supplies Drop and European Leaders Address Debt Crisis,1
 European Officials Consider Precautionary Credit Lines to Contain Debt Crisis,1
" MSCI Emerging Markets Index Climbs, Driven by Apple Suppliers",0
 China's Central Bank Sets Strongest Yuan Fixing Since 2005,1
 Wipro Ltd. Plunges After Earnings Report,-1
 Apple Third-Quarter Earnings Exceed Expectations,1
 U.S. Stocks and Treasuries Decline Amid Debt Concerns,0
 European Leaders to Discuss Steps to Contain Debt Crisis.,1
Euro and Stocks Surge as Europe Outlines Debt Crisis Containment Plan,1
U.S. Stocks Boosted by Better-than-Estimated Quarterly Results from Morgan Stanley,1
"U.S. Equities Erase Previous Day's Drop, Reach Highest Level Since July 8",1
Morgan Stanley Reports Smaller than Estimated Second-Quarter Loss,1
U.S. Jobless Benefit Claims Increase More than Forecasted,1
S&P Reiterates 50% Chance of Downgrading U.S. Credit Rating,1
"No Deal on Raising U.S. Debt Limit, According to Obama's Spokesman and House Speaker",1
 Euro Increases Against 13 of 16 Major Peers,1
" European Stocks Erase Earlier Losses, Banks Lead Gains",-1
 Spanish 10-Year Bond Yield Decreases 25 Basis Points,1
 Euro-Area Leaders Redouble Efforts to End Sovereign Bond Crisis,1
 Oil Trades Above $100 a Barrel for the First Time Since June 15,1
 Shanghai Composite Index Sinks 1% as Industrial Output Contracts,-1
 Turkey's ISE National 100 Index Slides 1.2% After Fitch Ratings Warning,-1
 Emerging Markets Index Advances for a Third Straight Gain.,1
"Treasuries, Dollar Rise Amid Speculation of U.S. Debt-Deal",-1
U.S. Technology Stocks Climb Amid Improving Earnings,0
Industrial Companies Retreat Amid Market Fluctuations,0
Advanced Micro Devices Inc. Leads Rally in Technology Stocks,1
Caterpillar Inc. Drags Dow Jones Lower After Earnings Miss Estimates,-1
U.S. Lawmakers Nearing Deal to Raise Debt Limit,0
Euro Falls Against Major Peers Amid Skepticism About Europe's Debt-Crisis Plan,0
Advanced Micro Devices' Earnings and Sales Forecast Top Estimates,1
Caterpillar Reports Slow Demand for Construction Equipment in China,-1
 Earnings Season: 83% of S&P 500 Companies Top Analyst Estimates,0
 Euro Falls Amid Concerns Over Measures to Contain Debt Crisis,0
 Norwegian Stock Index and Currency React to Bombing in Oslo,-1
 MSCI Emerging Markets Index Increases by 0.9%,0
 Crude Oil Climbs to Six-Week High in New York,1
 Corn and Soybeans Gain Amid Smaller Than Forecasted Harvests in U.S.,1
U.S. Stocks and Treasuries Retreat Amid Political Stalemate Over Debt Ceiling,-1
"S&P 500 Slips 0.6 Percent, Pulling Away from Two-Week High",-1
30-Year Treasury Yield Rises Six Basis Points to 4.32 Percent,1
"Oil Loses 0.7 Percent, Ending Five-Day Gain Streak",0
Gold and Swiss Franc Reach Record Highs Amid Market Uncertainty,0
Travelers Cos. and Boeing Co. Lead Declines in Dow Jones Industrial Average,-1
Kimberly-Clark Corp. Reports Decline in Second-Quarter Profit Due to Higher Commodity Costs,-1
" U.S. Debt Insurance Costs Rise, Credit-Default Swaps on Treasuries Approach 17-Month High",-1
 House Speaker John Boehner Proposes Two-Step Debt-Limit Plan,-1
 Senate Majority Leader Harry Reid Prepares Proposal for $2.4 Trillion in Additional Borrowing Authority,-1
" Stoxx Europe 600 Index Falls 0.3 Percent, Ending Four-Day Rally",0
 Swiss Franc Strengthens Against All 16 Major Peers,1
" Shanghai Composite Index Tumbles 3 Percent, Largest Drop in Six Months",-1
 Turkish Lira Weakens 1.2 Percent Amid Concerns Over Country's Record Current-Account Deficit,0
" Gold Rises to Record $1,624.07 an Ounce",1
" Crude Oil Retreats 0.7 Percent to $99.20 a Barrel, Ending Four Weeks of Gains.",0
Dollar Slides to Record Low Amid Debt-Limit Fight,-1
"U.S. Default Risk Rises, Credit-Default Swaps Increase",0
S&P 500 and Stoxx Europe 600 Indexes Fall Amid Debt Wrangle,0
"Commodities Rebound with Zinc, Cotton, and Copper Gaining",0
Obama Administration Threatens Veto of Boehner's Two-Step Plan,0
"Home Prices Fall Most in 18 Months, Pressuring Stocks",0
Corporate Earnings Show Resilience Despite Slow Economic Rebound,0
Boehner's Two-Step Plan Faces Opposition from Obama's Office,0
" Treasuries Rise, 10-Year Yield Falls Following Auction",-1
 S&P 500 Extends Losses After Home Prices Drop,0
" Consumer Confidence Rises in July, Led by Job Outlook",0
" 3M Projects Lower Full-Year Earnings, Citing Lower Demand for LCD TVs",-1
" Technology Companies Rally, Limiting Stock Losses",1
" MSCI Emerging Markets Index Climbs, Led by Technology Companies",0
 New Zealand Dollar Climbs to Record High Against U.S. Dollar,0
 Copper Advances as Strike at BHP Billiton's Escondida Mine Continues,0
" Gold Futures Rise, Reach Record High",0
 Corn and Soybean Futures Climb as Midwest Weather Worsens Crop Conditions.,1
"Stocks, Treasuries Slide on U.S. Debt Concern; Dollar Rallies",0
S&P 500 Suffers Biggest Slide Since June 1 Amid Debt Ceiling Stalemate,-1
U.S. Default Insurance Cost Climbs to Highest Level Since February 2010,-1
Industrial Companies Lead Declines After Durable Goods Orders Fall 2.1%,-1
S&P 500 Loses Almost 3% This Week as Debt Agreement Deadline Looms,-1
Amazon.com Inc. Jumps 3.9% After Sales and Profit Beat Analysts Estimates,1
U.S. Economy Grows at Slower Pace as Shoppers Restrain Spending,-1
"Brazil's Bovespa Index Drops 1.7%, Enters Bear Market",-1
Credit-Default Swaps on U.S. Rise for a Third Day,-1
 Rates Climb on Treasury Bills Set to Mature After Debt Ceiling Deadline,1
" U.S. Faces Massive Consequences if Nation Defaults, Warns Pimco's El-Erian",-1
 European Stocks Slump for a Third Day Amid Government Debt Crisis,-1
" Euro Depreciates 1% Against Dollar, Snapping Two-Day Gain",0
 Oil Slides 2% After Unexpected Increase in U.S. Inventories,-1
 MSCI Emerging Markets Index Slips 0.7%,-1
 China's Shanghai Composite Index Rises 0.8% After Industrial Profit Growth Accelerates.,1
U.S. Stocks and Six-Month Treasury Bills Decline as Debt Ceiling Deadline Looms,-1
Dollar Gains and Commodities Retreat Amidst Debt Ceiling Uncertainty,1
"Boehner Delays Vote on Debt-Limit Legislation, S&P 500 Futures Drop",0
Bankers Call on Obama and Congress to Raise Federal Debt Limit,0
U.S. Stocks and Treasuries Move in Tandem Amidst AAA Credit Rating Concerns,0
Treasury to Prioritize Interest Payments if Debt Ceiling Not Raised,0
Credit-Default Swaps Climb for Fourth Consecutive Day,0
S&P 500 Tumbles Amidst Debt Ceiling Impasse and Earnings Season,0
"Jobless Claims Fall, But Market Optimism Fades Amidst Political Deadlock",0
 Federal Reserve Bank of San Francisco President Warns of Limited Central Bank Power in Event of Default,0
 Financial Services Forum Warns of Grave Consequences of U.S. Default or Credit Downgrade,0
 European Shares Fall as Earnings Miss Estimates,0
" Italian and Spanish Bond Yields Rise, Greek Two-Year Note Yield Jumps",0
" MSCI Emerging Markets Index Slips, Led by Asian Exporters.",0
Treasury Yields Fall to 2011 Low Amid Economic Growth Concerns,-1
Stocks Retreat Following Lower than Expected GDP Growth,0
Gold Settles at Record High Amid Market Uncertainty,1
S&P 500 Experiences Worst Weekly Slide in a Year,-1
Lawmakers Plan Vote on Boehner's Two-Step Borrowing-Limit Plan,-1
Obama and Republicans in Rough Agreement on Debt Ceiling Raise,-1
Treasury to Delay Quarterly Auctions if Debt Ceiling Not Extended,-1
Investors Withdraw from Money-Market Mutual Funds Amid Debt-Ceiling Debate,-1
S&P 500 Plunges as GDP Growth Spurs Recovery Concerns,-1
 Real-Estate Investment Trusts Tumble Amid Default Concerns,0
 Exxon Mobil Corp. and Newmont Mining Corp. Lead Declines in S&P 500,-1
 Spain's 10-Year Bond Yield Increases as Moody's Considers Rating Cut,0
 Asian Exporters Lead Retreat in MSCI Emerging Markets Index.,0
"Treasuries Rally, Dollar Gains Amid Economic Concerns",1
U.S. Stocks Trim Losses as Debt Ceiling Plan Optimism Grows,0
10-Year Treasury Yields Fall to Lowest Level Since November,-1
Euro Slips Amid Concerns Over Deteriorating Global Economy,1
S&P 500 Records Sixth Straight Loss Despite Early Gains,0
"ISM Factory Index Sinks to Two-Year Low, Impacting Stocks",0
"U.S. Bond Yields Decrease, Credit-Default Swaps Drop",0
Global Manufacturing Indexes Fall as Demand Weakens,-1
Health-Care Stocks Decline Following Medicare Rate Cut Announcement,-1
" Oil Prices Fall to One-Month Low, Gold Futures Retreat from Record",-1
" Commodities Outperform Stocks, Bonds, and Dollar in July",-1
 Spanish and Italian Bond Yields Increase Amid Economic Concerns,-1
" Earnings at European Companies Trail Projections, Impacting Stocks.",-1
Stock Plunge Deepens in Asia Following U.S. Market Slide,-1
"S&P 500 Tumbles 4.1%, Dow Loses Over 1,000 Points",-1
Yen Climbs Toward 109 per Dollar as Havens Catch a Bid,0
"Treasuries, Gold, and Yen Rally on Demand for Haven Assets",1
Concerns Rise Over Inflation Forcing Interest Rates Higher,-1
Cboe Volatility Index Doubles to Highest Level in 2 1/2 Years,1
Anxiety Builds Over Outlook for Monetary Policy,-1
"Oil Slumps, Copper and Nickel Advance After Chinese PMI Rise",-1
 Monetary Policy Decisions Due in Multiple Countries,-1
 Earnings Season Continues with Reports from Major Companies,-1
 Futures on Japan's Nikkei 225 Stock Average Sink 6.8%,-1
 Yield on 10-Year Treasuries Falls 13 Basis Points to 2.71%,-1
 West Texas Intermediate Crude Dips 3% to $63.49 a Barrel,-1
" Gold Advances 0.5% to $1,339.99 an Ounce.",1
U.S. Stocks Rise on Speculation of More Federal Reserve Stimulus,1
"Dow Jones Halts Eight-Day Drop, Gains 29.82 Points",0
"S&P 500 Rises 0.5 Percent, Trading at Cheapest Valuation in Over a Year",1
"Ten-Year Treasury Yields Rise Slightly, Remain Near Nine-Month Low",0
Oil Prices Slide to Five-Week Low Amid Increased Stockpiles,-1
Swiss Franc Falls from Record Highs After Interest Rate Reduction,0
Speculation Grows for Third Round of Fed Asset Purchases,1
Over $2 Trillion Erased from Global Equities Value in Past Week,0
Service Industries Experience Slowest Growth Since February 2010,0
" Coca-Cola, General Electric, and Walt Disney Lead Gains in Dow",1
" MasterCard Profits Rise 33 Percent, Leading Gains in S&P 500",1
" S&P 500 Price-to-Earnings Ratio Drops to 13.8, Lowest Since July 2010",1
 Former Fed Officials Advocate for Third Round of Bond Purchases,1
 Pimco and BlackRock Predict U.S. Economy Stalling,1
 S&P 500 Experiences Worst Drop in a Year Following Weak GDP Data,1
 Thirty-Year Treasury Bond Yields Decrease for Fifth Consecutive Day,0
" U.S. Companies Add 114,000 Workers in July, Surpassing Economists' Predictions",1
 Societe Generale Shares Slide 9 Percent After Profit Fall,-1
 Swiss National Bank Lowers Target for Three-Month Libor to Near Zero,0
" Gold Futures Rise 1.3 Percent to Record $1,675.90 an Ounce",0
 MSCI Emerging Markets Index of Stocks Drops 2.2 Percent,0
 South Korea's Kospi Index Experiences Largest Two-Day Plunge Since November 2009.,-1
"Global Equities Experience Significant Rout, S&P 500 Records Worst Slump Since 2009",-1
Two-Year Treasury Yields Plunge to Record Low Amid Economic Concerns,-1
Yen Recovers from Biggest Drop Versus Dollar Since 2008,-1
"Brazil's Stocks Slump to Two-Year Low, Switzerland Enters Bear Market",-1
Investors Flee Stocks for Safety of Treasuries Amid Recession Fears,-1
European Central Bank Resumes Bond Purchases to Stem Debt Crisis,-1
"U.S. Employers Expected to Add 85,000 Jobs in July",-1
S&P 500's Valuation Drops to Cheapest Level Since 2009,-1
Energy and Raw-Material Producers Experience Biggest Slumps in S&P 500,-1
 Gap Inc. and DirecTV Stocks Tumble After Sales Miss Analysts' Estimates,-1
 U.S. 30-Year Mortgage Rates Plunge to Lowest Level in Over Eight Months,-1
 Speculation of Third Round of Quantitative Easing Increases Amid Weak U.S. Data,-1
 Yen Weakens Against Most-Traded Peers Following Japan's Intervention,-1
 Swiss Franc Rallies to Record After U.S. Markets Close,0
 10-Year U.S. Treasury Yield Sinks to Lowest Since October,-1
 Treasury Bond Yields Sink to 1950s Levels Amid Economic Stalling Concerns,-1
 Stoxx Europe 600 Index Sinks to Lowest Level Since July 2010,-1
" Swiss Market Index Enters Bear Market, MSCI Emerging Markets Index Sinks 3 Percent",-1
 Turkish Lira Drops After Central Bank Reduces Benchmark Interest Rate to Record Low,-1
 South Korea's Kospi Index Completes Biggest Three-Day Sell-Off Since November 2008.,-1
"Treasuries, Dollar Sink on Stronger-than-Forecast Jobs Growth",0
Two-Year Note Yields Rise Three Basis Points to 0.29 Percent,1
"S&P 500 Index Slides 7.2 Percent Over Five Days, Worst Weekly Drop Since November 2008",0
U.S. Unemployment Rate Falls to 9.1 Percent in July,0
Speculation Grows Over Potential Cut to American Government's Credit Rating,0
Ten-Year Treasury Yields Surge 16 Basis Points to 2.57 Percent,1
Credit-Default Swaps Protecting U.S. Government Debt Rise to 55.39 Basis Points,0
" S&P 500 Erases 2011 Gain, Down About 4.6 Percent for the Year",0
" Bank of America Corp. Drops 7.5 Percent, Citigroup Inc. Slumps 3.9 Percent",-1
" S&P 500 Surges 1.5 Percent in First Five Minutes of Trading, Erases Gain in Less Than 20 Minutes",0
 Italian 10-Year Bond Yields Up 76 Basis Points Since EU Summit,1
 MSCI Emerging Markets Index Falls 3 Percent,0
 S&P GSCI Index of 24 Commodities Rises 0.1 Percent,-1
" Gold Falls for Second Straight Day, Silver Caps Biggest Weekly Drop in Three Months",0
" Oil Rises for First Time in Six Days in New York, Curbs Biggest Weekly Plunge in Three Months.",0
U.S. Stocks Sink Following S&P's Reduction of Nation's Credit Rating,-1
Gold Surges to Record High Amid Economic Slowdown Concerns,1
Global Equities Lose Approximately $2.5 Trillion as Dow Jones Plunges,-1
S&P 500 Index Hits Lowest Level Since September,-1
Treasuries Rally as Investors Seek Safety Amid Market Turmoil,-1
"S&P Downgrades Debt Rankings on Fannie Mae, Freddie Mac and Other Government-Backed Lenders",-1
Berkshire Hathaway Credit Outlook Reduced to Negative by S&P,-1
Investors Retreat from Riskier Assets Following S&P Downgrade,-1
Spanish and Italian Bonds Yield Slide as ECB Buys Debt,-1
 S&P 500's Three-Day Slide Marks Worst Since November 2008,-1
" Financial Companies in S&P 500 Tumble, Reaching Lowest Level in Two Years",-1
 Berkshire Hathaway Shares Fall Most Since 2008 Following S&P's Downgrade,-1
 Demand for Equity Options Soars Amid Market Volatility,-1
" U.S. Downgraded to AA+ by S&P, Leaving Debt Rated Higher Than Japan and China",-1
" Treasuries Rally, Credit-Default Swaps on U.S. Debt Rise",-1
 Dollar Depreciates Against Swiss Franc and Yen Amid Market Turmoil,1
 European Bank Bonds Become Riskiest Ever Amid Debt Crisis,-1
 ECB Buys Italian and Spanish Bonds to Stem Debt Crisis,-1
 MSCI Emerging Markets Index Retreats Most Since November 2008,-1
" Gold Futures Climb to Record High, Oil Declines to Eight-Month Low.",0
U.S. Stocks Rally Following Federal Reserve Statement,1
10-Year Treasury Yields Hit Record Low,-1
Dollar Weakens as Swiss Franc Strengthens,0
Federal Reserve Pledges to Keep Interest Rates Near Zero Until Mid-2013,1
Speculation of Third Round of Quantitative Easing by Federal Reserve,1
U.S. Stocks Rebound After $1 Trillion Rout,1
MSCI All-Country World Index Records Biggest Gain of the Year,1
Financial Shares in S&P 500 Lead Market Advance,1
 Federal Reserve's Efforts to Revive U.S. Economy and Confidence,1
 Federal Reserve's Major Policy Change to Keep Federal Funds Rate Low,1
 Treasury Note and Bond Yields Plunge After Federal Reserve Statement,-1
 Moody's Affirms U.S. Government's Top Aaa Ranking,1
 European Shares Recover Amid Speculation of Federal Reserve Action,1
 Italian 10-Year Note Yield Falls,1
 European Central Bank Buys Italian and Spanish Bonds for Second Day,1
 S&P GSCI Index of 24 Commodities Loses 1 Percent,1
 Gold Futures Hit Record High.,1
"Stocks Plunge as Treasuries, Gold Rally on Europe Debt Concern",-1
Dow Jones Average Drops to Lowest Level Since September 2010,-1
Dollar Climbs Versus 13 of 16 Major Peers,1
"Gold Futures Surge to Record Above $1,800 an Ounce",1
Central Banks Fight to Prevent Recession Amid Equities Echo of 2008-2009 Bear Market,-1
European Central Bank Buys Italian and Spanish Bonds to Reduce Borrowing Costs,-1
Walt Disney Co. Slides 9.1 Percent on Concerns Over Slowing Consumer Spending,-1
"Financial Shares Fall the Most Among 10 Groups, Goldman Sachs and Citigroup Drop More Than 10 Percent",-1
Bank of America Loses 11 Percent Despite CEO's Assurance of Meeting Capital Targets,-1
 S&P 500 Wipes Out Most of 4.7 Percent Gain from Previous Day,-1
 S&P 500 Slumps 18 Percent from Three-Year High at End of April,-1
" Two-Year Treasury Yields Slip to 0.18 Percent, Close to Record Low",-1
 Cost to Insure French Government Debt Against Default Rises to Record,-1
 Societe Generale Denies Market Rumors After Shares Decline as Much as 23 Percent,-1
 Swiss Franc Weakens Against Yen and Dollar as Swiss National Bank Boosts Liquidity Supply,0
 S&P GSCI Index of 24 Commodities Rises for First Time This Week,1
 Oil Rises 4.5 Percent Following Unexpected Decline in Supplies,1
" Gold Futures Settle Up 2.4 Percent at $1,784.30 an Ounce.",1
U.S. Stocks Surge on Unexpected Drop in Jobless Claims,1
Swiss Franc Slides on Plans to Peg Currency to Euro,1
Unemployment Rate at Four-Decade Low Prompts Larger Pay Gains,1
Turkey's Labor Market Likely to Suffer from Easing Activity,1
China's Youth Unemployment Inspires College Grads to Protest,1
"RBA Warns of Tight Labor Market in Australia, Eyes Wage Gains",1
Euro Volatility Curve Inverts as Data Reports Call the Shots,1
Stocks Surge on Tempered Concern About Recession,1
" Prechter Discusses Investment Strategy, Stocks, Gold",1
 Stock Market Volatility Amid European Debt Crisis,1
" European Debt Crisis, Contagion, and ECB Bond Buying.",1
"U.S. Stocks Rise, Capping Week of Record Swings",1
Increase in Retail Sales Tempers Concerns of Slowing Economy,1
European Shares Rebound After Short-Sales Ban,1
Treasuries Gain as S&P 500 Trims Weekly Drop,0
Swiss Franc Slides as Nation Considers Pegging to Euro,1
Global Equity Markets Lose $6.8 Trillion in Value Amidst Multiple Crises,1
"Retail Sales Climb in July, Easing Economic Concerns",1
Short-Selling Ban in Europe Provides Temporary Market Relief,1
Unprecedented Swings in U.S. Equities This Week,1
 S&P 500 Rallies for Biggest Back-to-Back Gain Since March 2009,1
 Confidence Among U.S. Consumers Plunges in August,1
 Cost to Protect U.S. Companies' Debt Falls from Year High,1
" Societe Generale SA Rallies, Paring Week's Losses",1
 European Regulators Divided Over Response to Bank Stocks Rout,1
 Treasury Note Yields Set Record Lows Amidst Widening Debt Crisis,-1
 Swiss Franc Extends Losses After Central Bank's Euro Pegging Plan,1
 Italian 10-Year Bonds Rise for Sixth Day,1
" Crude Oil Slips, Gold Futures Slip",-1
 Emerging Markets Index Caps Weekly Drop of 4.9 Percent,0
 Developing-Nation Equity Mutual Funds See Third-Biggest Outflows on Record.,1
S&P 500 Index Erases Last Week's Loss on Takeovers,1
Swiss Franc Drops Amid Global Market Stabilization,1
Global Companies Announce $27 Billion in Deals,1
Motorola Mobility Holdings Surges 56% After Google's Acquisition Offer,-1
Swiss Government and Central Bank Discuss Franc Exchange Rate Target,1
S&P 500 Records Biggest Three-Day Rally Since March 2009,1
Federal Reserve Bank of Atlanta Considers More Treasury Purchases,1
Bank of America to Exit International Credit-Card Business,1
 MSCI Emerging Markets Index Records Biggest Advance Since April 2009,1
 Swiss Franc Depreciates Against Dollar and Euro,1
 Japanese Finance Minister Indicates Potential Market Intervention,1
 Euro Advances for Third Consecutive Day,1
 Crude Oil Futures Gain 2.9% Amid Corporate Deal Announcements,1
 Corn and Soybeans Prices Rise on Speculation of Crop Damage in the U.S.,1
"Stocks, Euro Decline as Germany, France Propose Transaction Tax",-1
U.S. Stocks Break Three-Day Winning Streak,-1
Euro Slides from Three-Week High Against Dollar,0
"Treasuries and Gold Rally, Oil Slides",1
NYSE Euronext and Nasdaq OMX Group Inc. Slide by at Least 2.7 Percent,-1
Germany and France Reject Sale of Common European Bonds,-1
Merkel and Sarkozy Propose Debt Limits and Euro Council,-1
European Economic Growth Slows More Than Forecast in Q2,-1
Financial Transaction Tax Raises Concerns for Weak European Economies,-1
" S&P 500 Retreat Led by Financial Firms, Energy Producers, and Industrial Companies",-1
" U.S. Housing Starts Fall, Signaling Struggle in Residential Real Estate",-1
 Berkshire Hathaway Makes Biggest Bets on Stocks Amid Market Decline,-1
 Wal-Mart and Home Depot Boost Profit Forecasts,1
 U.S. Treasuries Gain Following Rejection of Euro Bonds,-1
" Fitch Affirms AAA Credit Rating for U.S., Citing Central Role in Global Financial System",-1
 Euro Slumps Against 12 of 16 Major Counterparts,0
 Gold Rises to Record Settlement Amid Sagging European Economy,1
 Oil for September Delivery Falls 1.4 Percent,-1
